{
	"$schema": "../.schemas/menu.schema.json",
	"id": "menu:footer_company",
	"name": "footer_company",
	"label": "Footer: Company",
	"items": [
		{
			"type": "custom",
			"label": "About",
			"url": "/about"
		},
		{
			"type": "custom",
			"label": "Blog",
			"url": "/blog"
		},
		{
			"type": "custom",
			"label": "Careers",
			"url": "/careers"
		}
	]
}
